{
  "$schema": "https://json-schema.org/draft/2020-12/schema",
  "$id": "smetana/code-review-report.schema.json",
  "title": "Code review report input",
  "type": "object",
  "required": ["score", "pairs", "findings", "reviewer", "date"],
  "additionalProperties": false,
  "properties": {
    "score": { "type": "integer", "minimum": 0, "maximum": 100, "description": "Readiness, percent. Range is derived: >=90 high, 70–89 mid, <70 low." },
    "pairs": {
      "type": "array", "minItems": 1,
      "items": {
        "type": "object",
        "required": ["repo", "base", "head", "files", "added", "removed", "hazards"],
        "additionalProperties": false,
        "properties": {
          "repo": { "type": "string" },
          "base": { "type": "string", "examples": ["main"] },
          "head": { "type": "string", "examples": ["feature/smetana-6tev-worktree-gc-skip-live-agents"] },
          "files": { "type": "integer", "minimum": 0 },
          "added": { "type": "integer", "minimum": 0 },
          "removed": { "type": "integer", "minimum": 0 },
          "hazards": { "type": "boolean", "description": "Reviewer had [merge].hazards project rules for this repo." },
          "rulesSource": { "type": "string", "description": "Optional path the rules were loaded from, e.g. .smetana/review.toml" },
          "reviewedFiles": {
            "type": "array",
            "description": "Used only by the zero-findings state.",
            "items": {
              "type": "object", "required": ["path", "added", "removed"], "additionalProperties": false,
              "properties": { "path": { "type": "string" }, "added": { "type": "integer" }, "removed": { "type": "integer" } }
            }
          }
        }
      }
    },
    "findings": {
      "type": "array",
      "items": {
        "type": "object",
        "required": ["level", "title", "repo", "path", "line", "defect", "scenario", "fix"],
        "additionalProperties": false,
        "properties": {
          "level": { "enum": ["blocking", "serious", "minor"] },
          "title": { "type": "string", "description": "Short, sentence case, no trailing period." },
          "repo": { "type": "string", "description": "Must match a pairs[].repo." },
          "path": { "type": "string" },
          "line": { "type": "integer", "minimum": 1 },
          "defect": { "type": "string", "description": "One sentence. Inline `code` allowed." },
          "scenario": { "type": "string", "description": "input → result. Inline `code` allowed; rendered with .io for literals." },
          "fix": { "type": "string" },
          "code": {
            "type": "object",
            "required": ["startLine", "lines"],
            "additionalProperties": false,
            "properties": {
              "path": { "type": "string", "description": "Caption; defaults to finding.path." },
              "language": { "type": "string", "examples": ["rust", "ts"] },
              "startLine": { "type": "integer", "minimum": 1 },
              "lines": { "type": "array", "items": { "type": "string" }, "maxItems": 12 },
              "highlight": { "type": "array", "items": { "type": "integer" }, "description": "Absolute line numbers to mark with .hl" }
            }
          }
        }
      }
    },
    "reviewer": { "type": "string", "examples": ["claude-2"] },
    "date": { "type": "string", "description": "Local time, rendered as YYYY-MM-DD HH:mm." }
  }
}
